{"run":22,"commit":"55cdcfb","metric":1.8917238184732212,"metrics":{"metric_read_repeated_rps":795.1495875161514,"metric_read_repeated_live_mb":0.9331426620483398,"metric_read_repeated_words":100050,"metric_read_unique_rps":1549.4517200528105,"metric_read_unique_live_mb":0.9563627243041992,"metric_read_unique_words":113017,"metric_read_response_rps":454.7491442663238,"metric_read_response_live_mb":2.33172607421875,"metric_read_response_words":100061,"metric_read_filtered_rps":5391.562205148942,"metric_read_filtered_live_mb":0.057562828063964844,"metric_read_filtered_words":6008,"log_read_rps":998.8409283394061,"log_read_live_mb":1.2186269760131836,"log_read_words":106486,"json_roundtrip_rps":547.1837705293661,"json_roundtrip_live_mb":3.077169418334961,"json_roundtrip_words":130350,"metric_write_rps":1496.5765810708006,"metric_write_live_mb":3.9337987899780273,"metric_write_words":8,"throughput_rps":1137.942370808986,"live_mb":1.0847204071914962,"peak_rss_mb":297.671875,"holdout_unique_writer_ratio":1.2664192462229789,"holdout_long_labels_writer_ratio":4.564774009877857,"holdout_shuffled_writer_ratio":1.3671727912976779,"holdout_http_query_metrics_rps":96.36626891489172,"holdout_http_query_metrics_ratio":1.0347938658299876,"holdout_http_query_logs_rps":82.40020819785938,"holdout_http_query_logs_ratio":1.015310801477733},"status":"keep","description":"Share metric flat-map key tuples by updating only changed fields of the prior record","timestamp":1791197457031,"segment":3,"confidence":11.895301111209852,"asi":{"hypothesis":"BEAM flat maps created via map_update share immutable fixed key tuples; full array construction duplicates that tuple per sample","observations":"Repeated read live2.43->0.933MiB(-61.7% incremental; -85.3% from original6.36), words148002->100050. Unique live1.529->0.956MiB, words129001->113017. Filtered live0.141->0.0576MiB. Mixed1.8917 vs1.3932best.","tradeoff":"Unique-read paired throughput0.788x reference but memory ratio1.599x gives density1.26x; repeated throughput1.101x with density2.87x. Not catastrophic regression; main joint capacity metric wins.","correctness":"Exact Term equality uses enif_is_identical, not numeric ordering/series hash. Single-entry previous record+fields per batch. Duplicate rows preserved as list entries while shared record maps okay. Tests cover duplicates, equal-ts conflicts, changing labels/IDs and full parity/budgets.","next_action_hint":"Try same keytuple sharing for fixed 11-key Log structs; expect larger retained memory benefit, watch native transient allocations and throughput."}}
{"run":23,"commit":"55cdcfb","metric":1.8873050113630532,"metrics":{"metric_read_repeated_rps":1361.7098536729286,"metric_read_repeated_live_mb":0.9331426620483398,"metric_read_repeated_words":100050,"metric_read_unique_rps":2109.63973506441,"metric_read_unique_live_mb":0.9563627243041992,"metric_read_unique_words":113017,"metric_read_response_rps":695.3458186538105,"metric_read_response_live_mb":2.33172607421875,"metric_read_response_words":100061,"metric_read_filtered_rps":9150.17728468489,"metric_read_filtered_live_mb":0.057562828063964844,"metric_read_filtered_words":6008,"log_read_rps":1254.9807046716658,"log_read_live_mb":0.8644475936889648,"log_read_words":70552,"json_roundtrip_rps":578.3940888124123,"json_roundtrip_live_mb":3.077169418334961,"json_roundtrip_words":130350,"metric_write_rps":1836.1117273986122,"metric_write_live_mb":3.9337987899780273,"metric_write_words":8,"throughput_rps":1577.9658663044224,"live_mb":1.0327928495854506,"peak_rss_mb":249.640625,"holdout_unique_writer_ratio":1.2137481184144505,"holdout_long_labels_writer_ratio":3.8474076045686907,"holdout_shuffled_writer_ratio":1.3017455714087105,"holdout_http_query_metrics_rps":98.9229760977359,"holdout_http_query_metrics_ratio":1.0440949165955657,"holdout_http_query_logs_rps":81.61949399994695,"holdout_http_query_logs_ratio":1.0212489551004362},"status":"discard","description":"Share log struct key tuples and unchanged field terms through prior-record updates","timestamp":1791197778427,"segment":3,"confidence":9.336697174204499,"asi":{"hypothesis":"Map updates share fixed 11-key Log tuple and immutable unchanged fields, reducing retained structs","rollback_reason":"Mixed primary1.8873 just0.23% below1.8917best, despite lower memory; follow primary rule. Log paired speed1.108 vs prior1.247–1.665, possible CPU cost of multiple updates.","observations":"Log live1.2186->0.8644MiB(-29.1% incremental), words106486->70552. Field values also share by full exact equality, so separate per-string caches unnecessary. All correctness tests pass including duplicates and changed fields.","next_action_hint":"Add raw term identity fastpath before enif_is_identical in both metric and log update loops; most struct/nil/cached terms are already pointer-identical. This changes CPU cost assumption for targeted retry.","implementation":"One previous (Term,[Term;11]) per batch; map_update only differing fields. Template map keeps keys and unchanged values shared."}}
{"run":24,"commit":"df0c60d","metric":1.910786578470415,"metrics":{"metric_read_repeated_rps":1299.6331243992581,"metric_read_repeated_live_mb":0.9331426620483398,"metric_read_repeated_words":100050,"metric_read_unique_rps":2143.0102150153584,"metric_read_unique_live_mb":0.9563627243041992,"metric_read_unique_words":113017,"metric_read_response_rps":685.6545358190215,"metric_read_response_live_mb":2.33172607421875,"metric_read_response_words":100061,"metric_read_filtered_rps":9381.04637754803,"metric_read_filtered_live_mb":0.057562828063964844,"metric_read_filtered_words":6008,"log_read_rps":1260.1269577909975,"log_read_live_mb":0.8644475936889648,"log_read_words":70552,"json_roundtrip_rps":659.4901316919356,"json_roundtrip_live_mb":3.077169418334961,"json_roundtrip_words":130350,"metric_write_rps":1953.7450851100202,"metric_write_live_mb":3.9337987899780273,"metric_write_words":8,"throughput_rps":1618.4484790490374,"live_mb":1.0327928495854506,"peak_rss_mb":277.390625,"holdout_unique_writer_ratio":1.246708945693816,"holdout_long_labels_writer_ratio":5.330991458628062,"holdout_shuffled_writer_ratio":1.3019623116538985,"holdout_http_query_metrics_rps":99.24441915549616,"holdout_http_query_metrics_ratio":1.0260557952124494,"holdout_http_query_logs_rps":86.89947034772823,"holdout_http_query_logs_ratio":1.0601758273341613},"status":"keep","description":"Retry log flat-map sharing with raw-term identity fastpath for both metric and log updates","timestamp":1791198154030,"segment":3,"confidence":7.929664616493615,"asi":{"hypothesis":"Share Log fixed-key tuples and unchanged values, bypass exact FFI comparisons for already-identical raw terms","revisits_run":23,"changed_assumption":"Most unchanged struct/nil/immediate/cached terms have identical raw handles; short-circuit before calling enif_is_identical lowers comparison overhead. Applied same short-circuit to kept metric path.","observations":"Primary1.9108>1.8917best; log live1.2186->0.8644MiB(-29.1%), words106486->70552; original log memory1.7917 so total -51.8%. Full tests pass. HTTP logs ratio1.060x but real S3 production not measured.","caveat":"~1% index increment is small, but deterministic memory win clear and checks confirm semantics. Verify unchanged later; CPU effect of raw fastpath may be within noise.","validation":"Duplicate log records remain separate list entries sharing immutable map; changing attributes/body/trace/span/severity preserved; original fuzz/idempotency and query budget tests all pass."}}
{"run":25,"commit":"df0c60d","metric":1.9045329540893874,"metrics":{"metric_read_repeated_rps":1403.3159185725938,"metric_read_repeated_live_mb":0.9331426620483398,"metric_read_repeated_words":100050,"metric_read_unique_rps":2093.829745468822,"metric_read_unique_live_mb":0.9563627243041992,"metric_read_unique_words":113017,"metric_read_response_rps":701.888812038563,"metric_read_response_live_mb":2.33172607421875,"metric_read_response_words":100061,"metric_read_filtered_rps":9244.458139937986,"metric_read_filtered_live_mb":0.057562828063964844,"metric_read_filtered_words":6008,"log_read_rps":1245.2912424893373,"log_read_live_mb":0.8644475936889648,"log_read_words":70552,"json_roundtrip_rps":650.8898206256137,"json_roundtrip_live_mb":3.077169418334961,"json_roundtrip_words":130350,"metric_write_rps":1946.9615231728983,"metric_write_live_mb":3.9337987899780273,"metric_write_words":8,"throughput_rps":1626.2880948164463,"live_mb":1.0327928495854506,"peak_rss_mb":250.84375,"holdout_unique_writer_ratio":1.215857354770587,"holdout_long_labels_writer_ratio":5.016699125678532,"holdout_shuffled_writer_ratio":1.3657021653988917,"holdout_http_query_metrics_rps":99.07169818797864,"holdout_http_query_metrics_ratio":1.0416151082828697,"holdout_http_query_logs_rps":81.9656454657971,"holdout_http_query_logs_ratio":1.04693282844689},"status":"discard","description":"Own Parquet input via saved Erlang environment instead of copying whole blobs into Bytes","timestamp":1791198546736,"segment":3,"confidence":5.461672339590149,"asi":{"hypothesis":"Use existing object-store safe Bytes::from_owner pattern to eliminate full Parquet blob memcpy","rollback_reason":"Primary1.9045 slightly below1.9108best; retained memory unchanged; existing small/compressible segments do not make input copy a material bottleneck. Avoid new unsafe ownership code for no demonstrated gain.","next_action_hint":"Revisit only on production-sized/high-entropy segments or range-GET path where copied compressed payload is large. Do not retry by tweaking current fixtures to make it win.","safety":"OwnedEnv saves binary, obtains ptr/len from saved term, Bytes owner holds SavedTerm+OwnedEnv; Send+AsRef unsafe pattern identical to object_store PUT. <=64-byte heap binaries copied normally. No lifetime extension of caller slices.","validation":"Full checks pass plus concurrent decode of unaligned subbinaries after GC, both log and metric readers. No semantic mismatches.","implementation":"New binary_bytes.rs helper used in both Parquet decoders, remove bytes::Bytes imports. Source reverted."}}
{"run":26,"commit":"b321a85","metric":1.9141078302086918,"metrics":{"metric_read_repeated_rps":1361.8721202079125,"metric_read_repeated_live_mb":0.9331426620483398,"metric_read_repeated_words":100050,"metric_read_unique_rps":2022.8753487352815,"metric_read_unique_live_mb":0.9563627243041992,"metric_read_unique_words":113017,"metric_read_response_rps":707.352189181343,"metric_read_response_live_mb":2.33172607421875,"metric_read_response_words":100061,"metric_read_filtered_rps":9071.49471774422,"metric_read_filtered_live_mb":0.057562828063964844,"metric_read_filtered_words":6008,"log_read_rps":1244.61315867262,"log_read_live_mb":0.8644475936889648,"log_read_words":70552,"json_roundtrip_rps":657.3523490760091,"json_roundtrip_live_mb":3.077169418334961,"json_roundtrip_words":130350,"metric_write_rps":1985.5715136673505,"metric_write_live_mb":3.9337987899780273,"metric_write_words":8,"throughput_rps":1615.4943723212448,"live_mb":1.0327928495854506,"peak_rss_mb":232.5,"holdout_unique_writer_ratio":1.2150312971407766,"holdout_long_labels_writer_ratio":5.050254867711521,"holdout_shuffled_writer_ratio":1.2649934560012317,"holdout_http_query_metrics_rps":95.51166794413523,"holdout_http_query_metrics_ratio":1.0998299441177692,"holdout_http_query_logs_rps":82.72125350272808,"holdout_http_query_logs_ratio":1.067030609349332},"status":"keep","description":"Reserve exact metric Arrow label-column byte capacities before building the batch","timestamp":1791198848883,"segment":3,"confidence":3.9664544111624673,"asi":{"hypothesis":"Sum existing encoded label lengths to reserve metric Arrow buffers exactly, reducing transient reallocations and overshoot","observations":"Mixed1.9141>1.9108best, tiny0.17% increase; peak RSS232.5 vs277.4 previous but noisy. Writer1985 vs1954rps absolute difference small. All checks/holdouts pass; no semantic change.","caveat":"Do not attribute full RSS decline or tiny throughput change without unchanged verification. Simple capacity reservation useful independent of large speed claims.","next_action_hint":"Verify unchanged, then profile JSON response escaping/serialization if seeking HTTP request improvements."}}
{"run":27,"commit":"4e64e88","metric":1.9263234405580478,"metrics":{"metric_read_repeated_rps":1386.2615702300327,"metric_read_repeated_live_mb":0.9331426620483398,"metric_read_repeated_words":100050,"metric_read_unique_rps":2019.6410088106838,"metric_read_unique_live_mb":0.9563627243041992,"metric_read_unique_words":113017,"metric_read_response_rps":620.820776801997,"metric_read_response_live_mb":2.33172607421875,"metric_read_response_words":100061,"metric_read_filtered_rps":13005.31050178823,"metric_read_filtered_live_mb":0.057562828063964844,"metric_read_filtered_words":6008,"log_read_rps":1237.0050047160817,"log_read_live_mb":0.8644475936889648,"log_read_words":70552,"json_roundtrip_rps":513.2026733582593,"json_roundtrip_live_mb":3.077169418334961,"json_roundtrip_words":130350,"metric_write_rps":1400.2497111984972,"metric_write_live_mb":3.9337987899780273,"metric_write_words":8,"throughput_rps":1535.1583182737177,"live_mb":1.0327928495854506,"peak_rss_mb":284.375,"holdout_unique_writer_ratio":1.3002881252167362,"holdout_long_labels_writer_ratio":4.845278024171194,"holdout_shuffled_writer_ratio":1.3213665486013677,"holdout_http_query_metrics_rps":96.6121344840912,"holdout_http_query_metrics_ratio":1.0517347798243624,"holdout_http_query_logs_rps":84.00284769653692,"holdout_http_query_logs_ratio":1.0780839631450063},"status":"keep","description":"Preserve metric canonical-label dictionaries in Arrow instead of expanding per-sample byte columns","timestamp":1791199330787,"segment":3,"confidence":2.252790423369996,"asi":{"hypothesis":"Read labels_canonical as Arrow Dictionary<Int32,Binary> to preserve on-disk dictionary and reduce expanded-label buffers/arena copies","observations":"Mixed1.9263>1.9141best; filtered read13005rps vs9071 prior. Standard short-label retained memory unchanged; long-label test proves selected label references <2x one label length, not1024x expanded column.","validation":"All tests pass: non-finite fixture, all matchers, max sample bounds, multi-row-group pruning, plus >2MiB high-cardinality canonical column exercises plain encoding fallback pages and validates every row.","compatibility":"Derive reader schema from inferred schema, replace only labels_canonical Binary with Dictionary<Int32,Binary>, preserve other fields/schema metadata. Parquet-rs handles non-dictionary/fallback pages by building a dictionary; no stored format change or new dependencies.","next_action_hint":"Consider dictionary-preserving read of log low-cardinality string columns. Existing StringArena expects StringArray, so need wrapper for dictionary keys/values plus row-null semantics."}}
{"run":28,"commit":"4e64e88","metric":2.0425887623568917,"metrics":{"metric_read_repeated_rps":1363.9579787279388,"metric_read_repeated_live_mb":0.9331426620483398,"metric_read_repeated_words":100050,"metric_read_unique_rps":1983.6678017654644,"metric_read_unique_live_mb":0.9563627243041992,"metric_read_unique_words":113017,"metric_read_response_rps":674.432949421744,"metric_read_response_live_mb":2.33172607421875,"metric_read_response_words":100061,"metric_read_filtered_rps":10950.653617137772,"metric_read_filtered_live_mb":0.057562828063964844,"metric_read_filtered_words":6008,"log_read_rps":1026.9444551417826,"log_read_live_mb":0.8644475936889648,"log_read_words":70552,"json_roundtrip_rps":532.7597286921082,"json_roundtrip_live_mb":3.077169418334961,"json_roundtrip_words":130350,"metric_write_rps":1616.5371753033533,"metric_write_live_mb":3.9337987899780273,"metric_write_words":8,"throughput_rps":1507.2578079721436,"live_mb":1.0327928495854506,"peak_rss_mb":276.609375,"holdout_unique_writer_ratio":1.357339524944522,"holdout_long_labels_writer_ratio":4.761463390184875,"holdout_shuffled_writer_ratio":1.4555967825574265,"holdout_http_query_metrics_rps":98.65451681484026,"holdout_http_query_metrics_ratio":1.0342964206497056,"holdout_http_query_logs_rps":83.71248111237145,"holdout_http_query_logs_ratio":1.10251949005572},"status":"checks_failed","description":"Cache metric Erlang dictionary arena across Arrow batches using ArrayRef identity; arena reuse test fails","timestamp":1791199748117,"segment":3,"confidence":4.061483617959176,"asi":{"hypothesis":"Consecutive Arrow batches share dictionary values, so retain previous ArrayRef+BinaryArena and reuse when Arc::ptr_eq","rollback_reason":"New invariant test counts2 Erlang dictionary arenas for2000 rows split2 batches; Arc identity differs despite shared dictionary contents, so cache does not actually reuse arenas.","next_action_hint":"Arrow likely reconstructs ArrayRef wrappers over shared immutable value/offset buffers. Compare both value-data and offset buffer pointers+lengths while retaining prior ArrayRef owner, which prevents address reuse; do not remove or weaken the test.","observations":"All other correctness tests pass; benchmark index2.04 gain largely noise because intended cache not effective. No result-value mismatch.","implementation":"One previous_arena Option<(ArrayRef,BinaryArena)> outside batch loop, Arc::ptr_eq of labels_dict.values used. Test isolated supervised worker GC then Process.info binary count by unique address+arena size detected2copies."}}
{"run":29,"commit":"c8ee06e","metric":2.0527931313760415,"metrics":{"metric_read_repeated_rps":924.1966228315074,"metric_read_repeated_live_mb":0.9331426620483398,"metric_read_repeated_words":100050,"metric_read_unique_rps":1512.8545358845945,"metric_read_unique_live_mb":0.9563627243041992,"metric_read_unique_words":113017,"metric_read_response_rps":578.4198773990868,"metric_read_response_live_mb":2.33172607421875,"metric_read_response_words":100061,"metric_read_filtered_rps":10004.37691490027,"metric_read_filtered_live_mb":0.057562828063964844,"metric_read_filtered_words":6008,"log_read_rps":1008.5792270500949,"log_read_live_mb":0.8644475936889648,"log_read_words":70552,"json_roundtrip_rps":482.03224795738834,"json_roundtrip_live_mb":3.077169418334961,"json_roundtrip_words":130350,"metric_write_rps":1079.8431527820585,"metric_write_live_mb":3.9337987899780273,"metric_write_words":8,"throughput_rps":1229.5169309834396,"live_mb":1.0327928495854506,"peak_rss_mb":289.84375,"holdout_unique_writer_ratio":1.2803922189927783,"holdout_long_labels_writer_ratio":4.689537129446388,"holdout_shuffled_writer_ratio":1.3307129655708008,"holdout_http_query_metrics_rps":63.330687517943694,"holdout_http_query_metrics_ratio":1.085445152733588,"holdout_http_query_logs_rps":53.47538772998316,"holdout_http_query_logs_ratio":1.0754408687854935},"status":"keep","description":"Retry dictionary arena reuse using shared immutable value/offset buffer identity, not ArrayRef wrapper identity","timestamp":1791200096740,"segment":3,"confidence":4.786753713010068,"asi":{"hypothesis":"Reuse one Erlang dictionary arena across batches by comparing shared immutable buffers while retaining their previous owner","revisits_run":28,"changed_assumption":"parquet-rs DictionaryBuffer.into_array reconstructs ArrayRef wrappers via ArrayData but shares child value/offset buffers. Compare both buffer pointers+lengths; retained previous ArrayRef prevents address reuse.","observations":"Primary2.0528>1.9263best. Single-arena invariant now passes for2000 long-label samples across two batches. Standard short-label live memory unchanged, long labels avoid one dictionary copy per batch.","validation":"Full ExUnit/Rust checks and frozen-reference output equality pass, including plain fallback pages and multi-row-group reads. No unsafe code added.","next_action_hint":"User requested finalize; stop autonomous loop and propose independent groups, do not create branches until approval."}}
