{"type":"config","name":"Rust-backed stateless node memory and request capacity","metricName":"capacity_index","metricUnit":"","bestDirection":"higher"}
{"run":1,"commit":"b177817","metric":262.1145081416352,"metrics":{"metric_read_repeated_rps":192.3562437634499,"metric_read_repeated_live_mb":6.361380577087402,"metric_read_repeated_words":512000,"metric_read_unique_rps":952.551050782878,"metric_read_unique_live_mb":1.5294370651245117,"metric_read_unique_words":129001,"metric_read_filtered_rps":2404.207362885049,"metric_read_filtered_live_mb":0.36006832122802734,"metric_read_filtered_words":26880,"log_read_rps":627.032958419877,"log_read_live_mb":1.791701316833496,"log_read_words":164288,"json_roundtrip_rps":279.3344855880864,"json_roundtrip_live_mb":3.077169418334961,"json_roundtrip_words":130350,"metric_write_rps":319.3464043590784,"metric_write_live_mb":3.9337987899780273,"metric_write_words":8,"throughput_rps":539.436800782968,"live_mb":2.0580196213003203,"peak_rss_mb":223.8125},"status":"keep","description":"Baseline concurrent mixed Rust codec workload and live worker memory","timestamp":1791190319838,"segment":0,"confidence":null,"asi":{"hypothesis":"Establish fixed mixed workload capacity proxy before changes","observations":"Repeated metric labels consume 512000 result words for 8000 samples; label rebuilding is largest retained-term opportunity. All non-integration tests and Rust tests pass.","limitations":"Local codec pipeline capacity proxy excludes HTTP networking and S3 latency. RSS high-water includes fixture creation."}}
{"run":2,"commit":"57537f9","metric":817.0299460758978,"metrics":{"metric_read_repeated_rps":991.2849531204824,"metric_read_repeated_live_mb":2.4334707260131836,"metric_read_repeated_words":148002,"metric_read_unique_rps":2027.6264098339882,"metric_read_unique_live_mb":1.5294370651245117,"metric_read_unique_words":129001,"metric_read_filtered_rps":8071.296451992602,"metric_read_filtered_live_mb":0.1411733627319336,"metric_read_filtered_words":8480,"log_read_rps":962.0395237904357,"log_read_live_mb":1.791701316833496,"log_read_words":164288,"json_roundtrip_rps":440.21754083476253,"json_roundtrip_live_mb":3.077169418334961,"json_roundtrip_words":130350,"metric_write_rps":493.3754072916774,"metric_write_live_mb":3.9337987899780273,"metric_write_words":8,"throughput_rps":1225.635273476737,"live_mb":1.5001105888019466,"peak_rss_mb":208.140625},"status":"keep","description":"Share consecutive identical metric label maps and matcher decisions within each Arrow batch","timestamp":1791190588595,"segment":0,"confidence":null,"asi":{"hypothesis":"Immutable labels maps can be shared across consecutive equal canonical bytes with a single-entry cache","observations":"Repeated metric retained words fell 512000 to 148002 and live worker MiB fell 6.36 to 2.43. Filtered live memory 0.36 to 0.14. Unique label memory unchanged. Cache uses full bytes, not hash, and stores negative matches too.","caveat":"Unmodified logs/JSON/write throughput also increased substantially, indicating baseline host contention or warmup noise. Need unchanged verification, do not attribute entire throughput gain to this change.","validation":"Full available tests pass; added hash-collision/same-caller-ID, empty-label transitions, all matcher ops, budget and actual heap sharing tests."}}
{"run":3,"commit":"57537f9","metric":336.871611441892,"metrics":{"metric_read_repeated_rps":649.0257852535933,"metric_read_repeated_live_mb":2.4334707260131836,"metric_read_repeated_words":148002,"metric_read_unique_rps":483.3058117523863,"metric_read_unique_live_mb":1.5294370651245117,"metric_read_unique_words":129001,"metric_read_filtered_rps":1573.667300504885,"metric_read_filtered_live_mb":0.1411733627319336,"metric_read_filtered_words":8480,"log_read_rps":534.914302271157,"log_read_live_mb":1.791701316833496,"log_read_words":164288,"json_roundtrip_rps":237.5731898655237,"json_roundtrip_live_mb":3.077169418334961,"json_roundtrip_words":130350,"metric_write_rps":265.48966249626653,"metric_write_live_mb":3.9337987899780273,"metric_write_words":8,"throughput_rps":505.34467139075736,"live_mb":1.5001105888019466,"peak_rss_mb":237.875},"status":"discard","description":"Unchanged verification confirms deterministic memory savings but severe throughput noise","timestamp":1791190667747,"segment":0,"confidence":7.4229125184998495,"asi":{"hypothesis":"Verify kept optimization with identical source before proceeding","rollback_reason":"No code candidate in this verification; capacity below prior best, preserve already committed optimization.","next_action_hint":"Throughput fluctuates >2x across unchanged runs; inspect host load, use longer rounds and more robust paired controls. Memory metrics stable to the byte.","observations":"Retained sizes identical to run 2 for every workload, so 61.7% repeated-series live-memory reduction is reliable despite CPU noise."}}
{"type":"config","name":"Stateless codec capacity: longer mixed workload sampling","metricName":"capacity_index","metricUnit":"","bestDirection":"higher"}
{"run":4,"commit":"8876777","metric":935.5293305782286,"metrics":{"metric_read_repeated_rps":1226.3324229518332,"metric_read_repeated_live_mb":2.4334707260131836,"metric_read_repeated_words":148002,"metric_read_unique_rps":2702.7940133112606,"metric_read_unique_live_mb":1.5294370651245117,"metric_read_unique_words":129001,"metric_read_filtered_rps":8960.406205081297,"metric_read_filtered_live_mb":0.1411733627319336,"metric_read_filtered_words":8480,"log_read_rps":1129.6908648018923,"log_read_live_mb":1.791701316833496,"log_read_words":164288,"json_roundtrip_rps":546.1813390318254,"json_roundtrip_live_mb":3.077169418334961,"json_roundtrip_words":130350,"metric_write_rps":416.906605103458,"metric_write_live_mb":3.9337987899780273,"metric_write_words":8,"throughput_rps":1403.3974549351979,"live_mb":1.5001105888019466,"peak_rss_mb":273.421875},"status":"keep","description":"Reset baseline with tenfold longer throughput sampling to reduce contention noise","timestamp":1791190801568,"segment":1,"confidence":null,"asi":{"hypothesis":"Longer sampling reduces temporal noise without changing fixed payloads or algorithms","observations":"480 operations per case per round now vs 48. Baseline includes kept single-entry labels sharing. Memory metrics same as before.","limitations":"Host load still fluctuates; demand repeated verification for tiny changes. Peak RSS depends on allocator high-water mark and accumulated runs."}}
{"run":5,"commit":"8876777","metric":596.5530425474794,"metrics":{"metric_read_repeated_rps":776.3397521535342,"metric_read_repeated_live_mb":2.4334707260131836,"metric_read_repeated_words":148002,"metric_read_unique_rps":1545.8787837798668,"metric_read_unique_live_mb":1.5294370651245117,"metric_read_unique_words":129001,"metric_read_filtered_rps":6714.413607878245,"metric_read_filtered_live_mb":0.1411733627319336,"metric_read_filtered_words":8480,"log_read_rps":677.8387675761475,"log_read_live_mb":1.791701316833496,"log_read_words":164288,"json_roundtrip_rps":347.9107956719897,"json_roundtrip_live_mb":3.077169418334961,"json_roundtrip_words":130350,"metric_write_rps":270.2740748039809,"metric_write_live_mb":3.9337987899780273,"metric_write_words":8,"throughput_rps":894.8955359074924,"live_mb":1.5001105888019466,"peak_rss_mb":232.96875},"status":"discard","description":"Borrow Arrow canonical-label bytes and copy only accepted labels instead of an Erlang column arena","timestamp":1791191105954,"segment":1,"confidence":null,"asi":{"hypothesis":"Avoid copying entire label columns, especially for long strings and sparse queries, by allocating one accepted distinct label set","rollback_reason":"Primary capacity 596.55 vs 935.53; standard fixtures short labels yield identical retained memory. Peak RSS lower but confounded by contention.","next_action_hint":"Revisit only with paired measurement and legitimate long-label holdout; no need to modify fixed benchmark to favor it. Next try metric writer borrowed labels.","observations":"All tests pass including new long-label check showing only selected 1100-byte value retained, not entire arena. Existing make_subbinary already copies <=64-byte labels so baseline short-label live memory unaffected. Unmodified log/JSON rps fell by ~38% too, indicating host contention.","implementation":"Removed BinaryArena (and copied offsets), parse labels_arr.value(row), NewBinary copied per accepted distinct label key/value, kept one-entry map cache."}}
{"run":6,"commit":"8876777","metric":637.3118777209164,"metrics":{"metric_read_repeated_rps":626.7865047642304,"metric_read_repeated_live_mb":2.4334707260131836,"metric_read_repeated_words":148002,"metric_read_unique_rps":1553.7198643084653,"metric_read_unique_live_mb":1.5294370651245117,"metric_read_unique_words":129001,"metric_read_filtered_rps":5556.070006482081,"metric_read_filtered_live_mb":0.1411733627319336,"metric_read_filtered_words":8480,"log_read_rps":798.1098099334743,"log_read_live_mb":1.791701316833496,"log_read_words":164288,"json_roundtrip_rps":414.2273279575831,"json_roundtrip_live_mb":3.077169418334961,"json_roundtrip_words":130350,"metric_write_rps":426.86473190226934,"metric_write_live_mb":3.9337987899780273,"metric_write_words":8,"throughput_rps":956.0382961383983,"live_mb":1.5001105888019466,"peak_rss_mb":275.921875},"status":"discard","description":"Borrow metric writer label key/value bytes directly, eliminating per-label HashMap allocations","timestamp":1791191380120,"segment":1,"confidence":null,"asi":{"hypothesis":"Borrow immutable BEAM label slices to remove two Vec allocations per label plus HashMap hashing per sample","rollback_reason":"Mixed primary score 637 vs 935 baseline, though changed writer rps improved slightly while unmodified cases slowed 25-49%. Retained BEAM memory unaffected.","next_action_hint":"Need paired reference control under highly variable host load before throughput-only writer optimizations; next try deterministic log resource sharing.","observations":"Compiles safely using Binary<'a> as_slice lifetime, all tests pass. Writer 426 vs 417 rps with other paths lower suggests real benefit masked by contention, promising retry when paired controls available.","implementation":"Remove HashMap import; MapIterator collects borrowed (&[u8], &[u8]) pairs, sorts by key, finds __name__ in pairs."}}
{"run":7,"commit":"8876777","metric":619.7297034058624,"metrics":{"metric_read_repeated_rps":857.9947233324515,"metric_read_repeated_live_mb":2.4334707260131836,"metric_read_repeated_words":148002,"metric_read_unique_rps":1590.4783363596603,"metric_read_unique_live_mb":1.5294370651245117,"metric_read_unique_words":129001,"metric_read_filtered_rps":2627.905066929457,"metric_read_filtered_live_mb":0.1411733627319336,"metric_read_filtered_words":8480,"log_read_rps":812.5704650950199,"log_read_live_mb":1.2186269760131836,"log_read_words":122540,"json_roundtrip_rps":422.9999154000169,"json_roundtrip_live_mb":3.077169418334961,"json_roundtrip_words":130350,"metric_write_rps":356.2339833861376,"metric_write_live_mb":3.9337987899780273,"metric_write_words":8,"throughput_rps":871.819244297016,"live_mb":1.4067733715291366,"peak_rss_mb":286.75},"status":"discard","description":"Share consecutive equal log resource maps within Arrow batches","timestamp":1791191587362,"segment":1,"confidence":null,"asi":{"hypothesis":"Share immutable repeated resource metadata on logs without caching high-cardinality records","rollback_reason":"Primary score below baseline under severe host contention despite clear memory reduction; obey keep/discard contract.","next_action_hint":"Switch to paired frozen-reference benchmark before any further code trials. This is a promising retry after measurement assumptions change.","observations":"Log live memory 1.79 -> 1.22 MiB (-32%); result words 164288 -> 122540. Unmodified metric filtered rps simultaneously -71%, so absolute comparisons unreliable. All correctness tests pass.","implementation":"One-entry previous_resource Option<(&[u8],Term)> in materialize; compare full raw JSON bytes, null/empty use empty_map; tests assert :erts_debug.same and resource transitions/time filtering."}}
{"type":"config","name":"Paired frozen-reference Rust codec capacity per live MiB","metricName":"capacity_index","metricUnit":"","bestDirection":"higher"}
{"run":8,"commit":"1bdb0d8","metric":0.9600439741889375,"metrics":{"metric_read_repeated_rps":1255.535472800655,"metric_read_repeated_live_mb":2.4334707260131836,"metric_read_repeated_words":148002,"metric_read_unique_rps":2735.3232810202758,"metric_read_unique_live_mb":1.5294370651245117,"metric_read_unique_words":129001,"metric_read_filtered_rps":7780.965812381462,"metric_read_filtered_live_mb":0.1411733627319336,"metric_read_filtered_words":8480,"log_read_rps":1013.3166699036504,"log_read_live_mb":1.791701316833496,"log_read_words":164288,"json_roundtrip_rps":539.4519168524779,"json_roundtrip_live_mb":3.077169418334961,"json_roundtrip_words":130350,"metric_write_rps":466.3445003410144,"metric_write_live_mb":3.9337987899780273,"metric_write_words":8,"throughput_rps":1376.8268411686597,"live_mb":1.5001105888019466,"peak_rss_mb":301.625},"status":"keep","description":"Paired frozen-reference baseline with alternating ordering and output equality checks","timestamp":1791192020881,"segment":2,"confidence":null,"asi":{"hypothesis":"Pair candidate with same-process frozen reference to control host CPU variation","observations":"Identical code yields 0.960 index, ~4% noise/bias remains rather than 30–60% absolute swings. Memory sizes exactly equal. Frozen reference revision 8876777 includes kept metric-label map sharing.","next_action_hint":"Retry log resource sharing from run 7 under paired controls, then writer borrowing from run 6."}}
{"run":9,"commit":"5f8a457","metric":1.0889061210040112,"metrics":{"metric_read_repeated_rps":1102.4244150260447,"metric_read_repeated_live_mb":2.4334707260131836,"metric_read_repeated_words":148002,"metric_read_unique_rps":2679.692951849267,"metric_read_unique_live_mb":1.5294370651245117,"metric_read_unique_words":129001,"metric_read_filtered_rps":8081.624406505708,"metric_read_filtered_live_mb":0.1411733627319336,"metric_read_filtered_words":8480,"log_read_rps":1192.5465838509317,"log_read_live_mb":1.2186269760131836,"log_read_words":122540,"json_roundtrip_rps":517.9625081471186,"json_roundtrip_live_mb":3.077169418334961,"json_roundtrip_words":130350,"metric_write_rps":402.8045265158667,"metric_write_live_mb":3.9337987899780273,"metric_write_words":8,"throughput_rps":1345.7573381609752,"live_mb":1.4067733715291366,"peak_rss_mb":301.265625},"status":"keep","description":"Retry log resource-map sharing under paired controls: 32% less live log memory","timestamp":1791192256491,"segment":2,"confidence":null,"asi":{"hypothesis":"Log resource metadata repeats in service-sorted runs, so share immutable maps after full JSON byte equality","revisits_run":7,"changed_assumption":"Frozen same-process paired controls replace unreliable absolute throughput comparisons under host contention.","observations":"Log paired throughput ratio 1.0609 and memory ratio 1.4703; capacity contribution 1.56x. Mixed paired index 1.089 vs 0.960 baseline. Log memory reduction deterministic at 32%. Single-entry cache stays bounded for unique resources.","validation":"All correctness tests pass plus resource transition/time filtering/actual heap sharing test; candidate/reference output equality verified on all six workloads."}}
{"run":10,"commit":"6f66f13","metric":1.1548795056874563,"metrics":{"metric_read_repeated_rps":222.78578775198,"metric_read_repeated_live_mb":2.4334707260131836,"metric_read_repeated_words":148002,"metric_read_unique_rps":426.28282266723386,"metric_read_unique_live_mb":1.5294370651245117,"metric_read_unique_words":129001,"metric_read_filtered_rps":1940.2013767345602,"metric_read_filtered_live_mb":0.1411733627319336,"metric_read_filtered_words":8480,"log_read_rps":634.5169277219123,"log_read_live_mb":1.2186269760131836,"log_read_words":122540,"json_roundtrip_rps":248.91630655910026,"json_roundtrip_live_mb":3.077169418334961,"json_roundtrip_words":130350,"metric_write_rps":324.8434153224579,"metric_write_live_mb":3.9337987899780273,"metric_write_words":8,"throughput_rps":459.8333424894165,"live_mb":1.4067733715291366,"peak_rss_mb":223.359375},"status":"keep","description":"Retry borrowed metric writer label bytes with paired controls: 1.54x writer throughput","timestamp":1791192669019,"segment":2,"confidence":2.9532444399113773,"asi":{"hypothesis":"Replace per-sample owned label HashMap with sorted borrowed binary slices to eliminate allocations and hashing","revisits_run":6,"changed_assumption":"Same-process paired frozen reference now isolates speed difference from whole-host CPU swings.","observations":"Writer paired throughput 1.5398x; mixed index rises 1.089 -> 1.155. Retained memory same (writer benefit is transient native allocations). Absolute throughput again collapsed under host contention but paired measurement survives.","validation":"Full existing ExUnit/Rust tests and baseline output equality pass. No unsafe lifetimes: borrowed slices are only held during NIF env lifetime; returned Row stores owned derived fields."}}
{"run":11,"commit":"6f66f13","metric":1.1247192150511776,"metrics":{"metric_read_repeated_rps":633.4008081138644,"metric_read_repeated_live_mb":2.4334707260131836,"metric_read_repeated_words":148002,"metric_read_unique_rps":1582.5914935707222,"metric_read_unique_live_mb":1.5294370651245117,"metric_read_unique_words":129001,"metric_read_filtered_rps":6897.9392406518555,"metric_read_filtered_live_mb":0.1411733627319336,"metric_read_filtered_words":8480,"log_read_rps":838.5539137756938,"log_read_live_mb":1.2186269760131836,"log_read_words":122540,"json_roundtrip_rps":371.7270594066307,"json_roundtrip_live_mb":3.077169418334961,"json_roundtrip_words":130350,"metric_write_rps":499.80320248901995,"metric_write_live_mb":3.9337987899780273,"metric_write_words":8,"throughput_rps":1012.4808885932988,"live_mb":1.4067733715291366,"peak_rss_mb":301},"status":"discard","description":"Retry selective metric label copies under paired controls; unique/repeated read throughput regresses","timestamp":1791193115815,"segment":2,"confidence":5.906488879822735,"asi":{"hypothesis":"Parse borrowed Arrow canonical labels and copy accepted distinct labels, removing whole-column Erlang arena","revisits_run":5,"changed_assumption":"Paired controls remove absolute throughput contention confounding; previous kept writer/log optimizations retained.","rollback_reason":"Mixed primary 1.1247 < 1.1549 best; paired repeated/unique reads 0.826/0.882x reference, while standard short-label retained memory unchanged.","next_action_hint":"Do not retry unconditional per-label copies again. A hybrid arena for short labels with copy-on-retain for long labels could bound long-label pinning without sacrificing small-label performance.","observations":"Long-label isolation correctness test passes, but per-key NewBinary allocations can cost more than subbinary materialization. Filtered case 1.107x faster; broad read workloads matter too."}}
{"run":12,"commit":"f554025","metric":1.24402284628669,"metrics":{"metric_read_repeated_rps":1161.4739103922877,"metric_read_repeated_live_mb":2.4334707260131836,"metric_read_repeated_words":148002,"metric_read_unique_rps":2144.1972661484856,"metric_read_unique_live_mb":1.5294370651245117,"metric_read_unique_words":129001,"metric_read_filtered_rps":7854.174166312138,"metric_read_filtered_live_mb":0.1411733627319336,"metric_read_filtered_words":8480,"log_read_rps":868.9701617370714,"log_read_live_mb":1.2186269760131836,"log_read_words":122540,"json_roundtrip_rps":93.67027050022656,"json_roundtrip_live_mb":3.077169418334961,"json_roundtrip_words":130350,"metric_write_rps":1042.4335611485012,"metric_write_live_mb":3.9337987899780273,"metric_write_words":8,"throughput_rps":1088.107051224295,"live_mb":1.4067733715291366,"peak_rss_mb":281.171875},"status":"keep","description":"Share derived metric writer label metadata across equal-map runs and drop rows before compression","timestamp":1791193497090,"segment":2,"confidence":7.929470481487809,"asi":{"hypothesis":"Consecutive equivalent Erlang label maps can reuse canonical bytes, JSON and stable hash; Rc shares metadata through stable row sorting","observations":"Writer paired ratio 3.120x frozen reference (was 1.54x with just borrowed slices); mixed index 1.244 >1.155. Row holds one Rc instead of three owned Vecs. Drop rows and one-entry cache after Arrow batch built to reduce compression-time peak native memory.","correctness":"Full map equality, not IDs, bounds cache lookup to one entry; unique labels get normal extraction. Tests cover Unicode/escaped strings, equal labels with varying explicit/nil IDs, empty-map transitions and invalid label key/value rejection. All ExUnit/Rust tests and reference output equality pass.","next_action_hint":"Run high-cardinality/long-label writer holdout before trusting 3x across all ingest shapes. Consider column capacities and JSON map allocation next."}}
