{"run":13,"commit":"f982331","metric":1.3368730774829312,"metrics":{"metric_read_repeated_rps":948.6859711085593,"metric_read_repeated_live_mb":2.4334707260131836,"metric_read_repeated_words":148002,"metric_read_unique_rps":2058.3631724522397,"metric_read_unique_live_mb":1.5294370651245117,"metric_read_unique_words":129001,"metric_read_filtered_rps":6376.026141707181,"metric_read_filtered_live_mb":0.1411733627319336,"metric_read_filtered_words":8480,"log_read_rps":956.9282602844868,"log_read_live_mb":1.2186269760131836,"log_read_words":122540,"json_roundtrip_rps":460.8538277270785,"json_roundtrip_live_mb":3.077169418334961,"json_roundtrip_words":130350,"metric_write_rps":1375.708991691291,"metric_write_live_mb":3.9337987899780273,"metric_write_words":8,"throughput_rps":1400.749967155478,"live_mb":1.4067733715291366,"peak_rss_mb":298.890625,"holdout_unique_writer_ratio":1.2317701946444897,"holdout_long_labels_writer_ratio":3.8924785244347397,"holdout_shuffled_writer_ratio":1.1835667462831048,"holdout_http_query_metrics_rps":76.19279825670877,"holdout_http_query_metrics_ratio":1.0521718462647591,"holdout_http_query_logs_rps":54.223931280204425,"holdout_http_query_logs_ratio":0.9202591903915195},"status":"keep","description":"Verify kept codecs on unique/shuffled/long-label writer holdouts and real loopback MCP HTTP","timestamp":1791193870697,"segment":2,"confidence":4.858652122874237,"asi":{"hypothesis":"Confirm writer optimizations generalize beyond repeated labels and assess HTTP end-to-end transfer","observations":"Frozen-reference writer holdouts: unique1.232x, long repeated labels3.892x, shuffled1.184x. Codec capacity unchanged source index varies1.244->1.337; noise remains. HTTP metrics1.052x, logs0.920x means HTTP gains not convincingly established.","http_limitations":"Single-concurrency actual Req->Bandit->Phoenix->MCP request, unchanged admission controls, 2000 records returned and validated; frozen decoder differs only at read NIF, common candidate HTTP/JSON code. Local immutable Parquet fixture replaces S3 I/O. Not production capacity or saturation.","next_action_hint":"HTTP encodes large escaped inner JSON text; general JSON encoding may dominate and bottleneck overall requests. Optimize response serialization without protocol changes."}}
{"run":14,"commit":"f982331","metric":1.3350065174863168,"metrics":{"metric_read_repeated_rps":1245.165256776423,"metric_read_repeated_live_mb":2.4334707260131836,"metric_read_repeated_words":148002,"metric_read_unique_rps":1711.8707537580913,"metric_read_unique_live_mb":1.5294370651245117,"metric_read_unique_words":129001,"metric_read_filtered_rps":2378.0505930263666,"metric_read_filtered_live_mb":0.1411733627319336,"metric_read_filtered_words":8480,"log_read_rps":657.6558678659752,"log_read_live_mb":1.2186269760131836,"log_read_words":122540,"json_roundtrip_rps":305.4251135799641,"json_roundtrip_live_mb":3.077169418334961,"json_roundtrip_words":130350,"metric_write_rps":729.5974901846338,"metric_write_live_mb":3.9337987899780273,"metric_write_words":8,"throughput_rps":951.6654557088916,"live_mb":1.4067733715291366,"peak_rss_mb":296.6875,"holdout_unique_writer_ratio":0,"holdout_long_labels_writer_ratio":0,"holdout_shuffled_writer_ratio":0,"holdout_http_query_metrics_rps":0,"holdout_http_query_metrics_ratio":0,"holdout_http_query_logs_rps":0,"holdout_http_query_logs_ratio":0},"status":"checks_failed","description":"Portable word-at-a-time JSON escape scanning; Rust test method ambiguity prevents keep","timestamp":1791194209274,"segment":2,"confidence":4.227226630288893,"asi":{"hypothesis":"Scan unescaped JSON strings eight bytes at a time using conservative SWAR detection without unsafe code","rollback_reason":"Rust test compilation fails: input.extend(array) ambiguous between Extend and out::Sink. ExUnit passed. Mixed metric slightly below best anyway.","next_action_hint":"Fix tests with extend_from_slice(&array) if revisiting; avoid per-eight-byte overhead for short/dense-escape strings. JSON paired throughput0.952x suggests no broad win.","error":"E0034 json_write.rs test line121. Not algorithm semantic failure.","unmeasured_metrics":"All holdout metrics use sentinel0 because holdout was not run this iteration; tool requires every secondary. Do not interpret as real zeros. Future iterations must run measure+holdout."}}
{"run":15,"commit":"f982331","metric":1.3389143707740367,"metrics":{"metric_read_repeated_rps":1254.9118032298293,"metric_read_repeated_live_mb":2.4334707260131836,"metric_read_repeated_words":148002,"metric_read_unique_rps":2414.924231752229,"metric_read_unique_live_mb":1.5294370651245117,"metric_read_unique_words":129001,"metric_read_filtered_rps":7116.488013165503,"metric_read_filtered_live_mb":0.1411733627319336,"metric_read_filtered_words":8480,"log_read_rps":1096.7167043663035,"log_read_live_mb":1.2186269760131836,"log_read_words":122540,"json_roundtrip_rps":589.0481227772638,"json_roundtrip_live_mb":3.077169418334961,"json_roundtrip_words":130350,"metric_write_rps":1638.3706403981241,"metric_write_live_mb":3.9337987899780273,"metric_write_words":8,"throughput_rps":1684.2503173174887,"live_mb":1.4067733715291366,"peak_rss_mb":283.859375,"holdout_unique_writer_ratio":1.4265969844853958,"holdout_long_labels_writer_ratio":4.454748383025714,"holdout_shuffled_writer_ratio":1.3776904620217219,"holdout_http_query_metrics_rps":96.04102872747238,"holdout_http_query_metrics_ratio":1.0086789076293392,"holdout_http_query_logs_rps":77.55480054521024,"holdout_http_query_logs_ratio":0.9846557827121301},"status":"checks_failed","description":"Avoid JSON binary-key entry vectors; unrelated query-slot cleanup assertion fails under load","timestamp":1791194515277,"segment":2,"confidence":3.062401431938264,"asi":{"hypothesis":"Avoid intermediate Vec allocations for JSON binary-key maps with two MapIterator passes; mixed keys retain full collision checks","rollback_reason":"ExUnit admission test checks Registry slot cleanup too early under load, leaving one worker PID visible; cannot keep failed checks. Primary1.3389 only0.15% above best, within noise.","next_action_hint":"Inspect query-slot test synchronization without weakening admission assertions. Binary-key map encoder gain not proven; prioritize memory changes instead.","failure":"test/pulso/promql/evaluator_test.exs:77 expected Registry.lookup(QuerySlots,{acme,0}) == [] but one PID remained. Existing 605 other tests pass.","implementation":"MapIterator all key.get_type==Binary then stream direct to Sink, else existing Vec path. No semantic mismatches."}}
{"type":"config","name":"Paired Rust request capacity including MCP metric response serialization","metricName":"capacity_index","metricUnit":"","bestDirection":"higher"}
{"run":16,"commit":"121f399","metric":1.2956410297613208,"metrics":{"metric_read_repeated_rps":900.7538183517331,"metric_read_repeated_live_mb":2.4334707260131836,"metric_read_repeated_words":148002,"metric_read_unique_rps":2031.8234345435383,"metric_read_unique_live_mb":1.5294370651245117,"metric_read_unique_words":129001,"metric_read_response_rps":377.65449806176696,"metric_read_response_live_mb":2.9048004150390625,"metric_read_response_words":148013,"metric_read_filtered_rps":5846.314994579979,"metric_read_filtered_live_mb":0.1411733627319336,"metric_read_filtered_words":8480,"log_read_rps":834.157353357744,"log_read_live_mb":1.2186269760131836,"log_read_words":122540,"json_roundtrip_rps":431.6861210214053,"json_roundtrip_live_mb":3.077169418334961,"json_roundtrip_words":130350,"metric_write_rps":1188.36001366614,"metric_write_live_mb":3.9337987899780273,"metric_write_words":8,"throughput_rps":1081.3745636248004,"live_mb":1.5603022443782169,"peak_rss_mb":299.421875,"holdout_unique_writer_ratio":1.2032575022185488,"holdout_long_labels_writer_ratio":4.43949761330018,"holdout_shuffled_writer_ratio":1.222325588355597,"holdout_http_query_metrics_rps":96.81393410682288,"holdout_http_query_metrics_ratio":1.0155489247797955,"holdout_http_query_logs_rps":83.66456366489832,"holdout_http_query_logs_ratio":1.061306454957282},"status":"keep","description":"Add real MCP metric response serialization workload before optimizing output copies; synchronize flaky worker-exit test","timestamp":1791194964226,"segment":3,"confidence":null,"asi":{"hypothesis":"End-to-end metric response encoding deserves measurement alongside decoder-only tests; baseline added before candidate output changes","observations":"Read+JSON response baseline377.65 rps,2.9048MiB versus read-only900.75rps2.43MiB. Seven-case paired baseline1.2956. Existing optimizations preserved.","test_fix":"Monitor actual blocked query workers before release, wait for all DOWNs after results, then retain original slot assertions. Full checks pass, avoids result-before-worker-exit race without sleeps.","limitations":"HTTP holdout contrasts only decoder NIF because common current encoder used on both paths; future encoder gain needs separate frozen response encoding validation."}}
{"run":17,"commit":"121f399","metric":1.24553025214089,"metrics":{"metric_read_repeated_rps":993.8464341618147,"metric_read_repeated_live_mb":2.4334707260131836,"metric_read_repeated_words":148002,"metric_read_unique_rps":2214.7576685984277,"metric_read_unique_live_mb":1.5294370651245117,"metric_read_unique_words":129001,"metric_read_response_rps":478.70223823215264,"metric_read_response_live_mb":2.9048004150390625,"metric_read_response_words":148013,"metric_read_filtered_rps":7092.722571111932,"metric_read_filtered_live_mb":0.1411733627319336,"metric_read_filtered_words":8480,"log_read_rps":1068.3522891673529,"log_read_live_mb":1.2186269760131836,"log_read_words":122540,"json_roundtrip_rps":233.54095773200592,"json_roundtrip_live_mb":3.077169418334961,"json_roundtrip_words":130350,"metric_write_rps":925.6009657103409,"metric_write_live_mb":3.9337987899780273,"metric_write_words":8,"throughput_rps":1081.0872683830014,"live_mb":1.5603022443782169,"peak_rss_mb":297.546875,"holdout_unique_writer_ratio":1.164512247074664,"holdout_long_labels_writer_ratio":3.8519143283870623,"holdout_shuffled_writer_ratio":1.1719796843028354,"holdout_http_query_metrics_rps":93.27082115630947,"holdout_http_query_metrics_ratio":1.0225124671997614,"holdout_http_query_logs_rps":84.07506221554604,"holdout_http_query_logs_ratio":1.0494336598359886},"status":"discard","description":"Write metric JSON directly into Erlang BinSink instead of Vec plus final copy","timestamp":1791195414527,"segment":3,"confidence":null,"asi":{"hypothesis":"Eliminate final metric JSON memcpy by writing to growable Erlang-owned output","rollback_reason":"Primary1.2455 below1.2956 baseline; read+response paired0.9429x reference, live memory unchanged. Saving copy does not offset growable binary writer overhead here.","next_action_hint":"Cache and repeat serialized labels by full Term equality before reconsidering direct Erlang output; maybe better capacity estimates later. Do not assume fewer copies always faster.","observations":"All checks pass including new randomized native response parity, large-growth/trailing-byte correctness, empty/unsupported input tests. Existing scalar writer semantics unchanged.","implementation":"metric_json encode returns Binary via BinSink; helpers generic Sink, lib.rs passes resulting binary through rather than copy. Test file added but discarded with candidate."}}
{"run":18,"commit":"1e21354","metric":1.3148649539334243,"metrics":{"metric_read_repeated_rps":813.597933461249,"metric_read_repeated_live_mb":2.4334707260131836,"metric_read_repeated_words":148002,"metric_read_unique_rps":2173.145356260017,"metric_read_unique_live_mb":1.5294370651245117,"metric_read_unique_words":129001,"metric_read_response_rps":550.0934585865577,"metric_read_response_live_mb":2.9048004150390625,"metric_read_response_words":148013,"metric_read_filtered_rps":6313.214346779603,"metric_read_filtered_live_mb":0.1411733627319336,"metric_read_filtered_words":8480,"log_read_rps":1033.4982624310462,"log_read_live_mb":1.2186269760131836,"log_read_words":122540,"json_roundtrip_rps":551.3337682744171,"json_roundtrip_live_mb":3.077169418334961,"json_roundtrip_words":130350,"metric_write_rps":1574.049175919671,"metric_write_live_mb":3.9337987899780273,"metric_write_words":8,"throughput_rps":1275.9888973406278,"live_mb":1.5603022443782169,"peak_rss_mb":283.78125,"holdout_unique_writer_ratio":1.2327354247184803,"holdout_long_labels_writer_ratio":4.3301341954168135,"holdout_shuffled_writer_ratio":1.3835582331954386,"holdout_http_query_metrics_rps":94.66484699794104,"holdout_http_query_metrics_ratio":1.0060232907919247,"holdout_http_query_logs_rps":82.01499917643271,"holdout_http_query_logs_ratio":1.0602728766121021},"status":"keep","description":"Reuse serialized label JSON ranges for consecutive equivalent metric label maps","timestamp":1791195786484,"segment":3,"confidence":1,"asi":{"hypothesis":"Single-entry full-map equality cache reuses prior label JSON output via Vec.extend_from_within, avoiding repeated native decoding and escaping","observations":"Read+response paired ratio1.183x vs reference; mixed1.3149 vs1.2956 baseline, ~1.5% total gain. Existing writer ratio also fluctuated upward, so verify unchanged before trusting mixed improvement magnitude.","correctness":"New metric_json_test randomized reference parity includes empty/repeated/unique labels, varying IDs, Unicode/control escapes, large output reallocations, integer/nil samples and invalid fields. Full ExUnit/Rust tests pass.","next_action_hint":"Verify, then consider direct Erlang BinSink again only with changed assumptions (serialized-label work removed); Vec copy might not be bottleneck."}}
{"run":19,"commit":"1e21354","metric":1.2372897249092865,"metrics":{"metric_read_repeated_rps":976.097805000061,"metric_read_repeated_live_mb":2.4334707260131836,"metric_read_repeated_words":148002,"metric_read_unique_rps":2531.6722750239983,"metric_read_unique_live_mb":1.5294370651245117,"metric_read_unique_words":129001,"metric_read_response_rps":629.0610477535968,"metric_read_response_live_mb":2.9048004150390625,"metric_read_response_words":148013,"metric_read_filtered_rps":1508.1155467861429,"metric_read_filtered_live_mb":0.1411733627319336,"metric_read_filtered_words":8480,"log_read_rps":311.0802911193058,"log_read_live_mb":1.2186269760131836,"log_read_words":122540,"json_roundtrip_rps":164.00942917543233,"json_roundtrip_live_mb":3.077169418334961,"json_roundtrip_words":130350,"metric_write_rps":378.081065306415,"metric_write_live_mb":3.9337987899780273,"metric_write_words":8,"throughput_rps":642.5512637253946,"live_mb":1.5603022443782169,"peak_rss_mb":287.359375,"holdout_unique_writer_ratio":1.3284773619195618,"holdout_long_labels_writer_ratio":2.7300847827827974,"holdout_shuffled_writer_ratio":1.185944679261013,"holdout_http_query_metrics_rps":49.45624914739487,"holdout_http_query_metrics_ratio":0.963872481315215,"holdout_http_query_logs_rps":67.25782558812764,"holdout_http_query_logs_ratio":1.004681847321099},"status":"discard","description":"Unchanged verification: metric JSON label reuse benefit persists, mixed paired score still noisy","timestamp":1791196151711,"segment":3,"confidence":0.6589029746927173,"asi":{"hypothesis":"Verify kept serialized metric labels reuse without source changes","rollback_reason":"Verification score below best; no code candidate to roll back, keep already committed implementation.","observations":"Response paired1.110x vs1.183x prior, so path-local benefit reproduced; mixed score varies6%. Writer paired2.675x vs3.761x prior. Deterministic memory savings persist.","next_action_hint":"Memory-focused log string/attribute term reuse could make larger robust gains. Add response holdout on unique labels to avoid assuming repeated-label advantage universally."}}
{"run":20,"commit":"91682ef","metric":1.3932140685011025,"metrics":{"metric_read_repeated_rps":1302.0515449655363,"metric_read_repeated_live_mb":2.4334707260131836,"metric_read_repeated_words":148002,"metric_read_unique_rps":2973.0014307569386,"metric_read_unique_live_mb":1.5294370651245117,"metric_read_unique_words":129001,"metric_read_response_rps":700.0135627627785,"metric_read_response_live_mb":2.9048004150390625,"metric_read_response_words":148013,"metric_read_filtered_rps":9097.456502786095,"metric_read_filtered_live_mb":0.1411733627319336,"metric_read_filtered_words":8480,"log_read_rps":1893.580761219466,"log_read_live_mb":1.2186269760131836,"log_read_words":106486,"json_roundtrip_rps":660.2294297268301,"json_roundtrip_live_mb":3.077169418334961,"json_roundtrip_words":130350,"metric_write_rps":1606.4095742010622,"metric_write_live_mb":3.9337987899780273,"metric_write_words":8,"throughput_rps":1746.2154203415423,"live_mb":1.5603022443782169,"peak_rss_mb":294.734375,"holdout_unique_writer_ratio":1.2397977062414287,"holdout_long_labels_writer_ratio":4.5777123870743575,"holdout_shuffled_writer_ratio":1.2475049804151792,"holdout_http_query_metrics_rps":97.796083755826,"holdout_http_query_metrics_ratio":0.9957654295733728,"holdout_http_query_logs_rps":82.32519274385751,"holdout_http_query_logs_ratio":1.0493599893757213},"status":"keep","description":"Reuse bounded JSON key interner across Parquet log rows and body/attribute/resource columns","timestamp":1791196576627,"segment":3,"confidence":1.947146769081467,"asi":{"hypothesis":"JSON key names repeat across log records even when attribute values are unique; retain existing bounded interning cache across batch documents","observations":"Log result words122540->106486(-13.1%), paired log throughput1.665x frozen vs prior1.1x. Live worker memory unchanged due BEAM heap size classes; no offheap increase. Mixed index1.393>1.315.","safety":"Column arenas remain in same NIF env, so borrowed key bytes live until call returns. Interner is still max128 keys<=32 bytes; escaped keys stay uncached; move cache into TermBuilder and back with mem::take each document.","validation":"Full tests and reference equality pass; new tests assert key identity across separate rows and columns and exact values for >128 unique keys, escaped and >32byte keys.","limitations":"HTTP holdout has empty attributes and 120-byte bodies, so does not stress key interning; end-to-end throughput gains there remain small."}}
{"run":21,"commit":"91682ef","metric":1.2907856726354625,"metrics":{"metric_read_repeated_rps":841.8054622651932,"metric_read_repeated_live_mb":2.4334707260131836,"metric_read_repeated_words":148002,"metric_read_unique_rps":745.6936193482637,"metric_read_unique_live_mb":1.5294370651245117,"metric_read_unique_words":129001,"metric_read_response_rps":202.5638677544909,"metric_read_response_live_mb":2.9048004150390625,"metric_read_response_words":148013,"metric_read_filtered_rps":3737.3863211660646,"metric_read_filtered_live_mb":0.1411733627319336,"metric_read_filtered_words":8480,"log_read_rps":1113.7924633376647,"log_read_live_mb":1.2186269760131836,"log_read_words":94528,"json_roundtrip_rps":223.5853683871716,"json_roundtrip_live_mb":3.077169418334961,"json_roundtrip_words":130350,"metric_write_rps":1173.7491013483443,"metric_write_live_mb":3.9337987899780273,"metric_write_words":8,"throughput_rps":754.2792356612495,"live_mb":1.5603022443782169,"peak_rss_mb":280.953125,"holdout_unique_writer_ratio":1.346877046031308,"holdout_long_labels_writer_ratio":4.741852834381185,"holdout_shuffled_writer_ratio":1.3848169437609075,"holdout_http_query_metrics_rps":76.80152374223104,"holdout_http_query_metrics_ratio":0.8816846926243016,"holdout_http_query_logs_rps":78.99003343253165,"holdout_http_query_logs_ratio":1.0711428325190373},"status":"discard","description":"Share repeated promoted log string terms with per-column single-entry caches","timestamp":1791197085091,"segment":3,"confidence":2.814551334820568,"asi":{"hypothesis":"Reuse prior severity/service/trace/span strings after full byte equality to avoid small heap binary copies","rollback_reason":"Primary1.2908 below1.3932 best. Result words106486->94528 but live worker memory unchanged due heap size classes; low absolute rates confounded by host load.","next_action_hint":"This is a deterministic term reduction but would need a more substantial structural change to reduce allocated heap. Explore fixed-key map keytuple sharing via map_put on prior record; measure CPU/memory tradeoff.","observations":"All tests pass including nil/empty/different string transitions and actual same-term assertions. No actual live-memory benefit in current workload.","implementation":"Four one-entry previous byte/term caches per materialize batch; sub_term checks nil, byte equality then creates empty binary or arena subbinary only on changes."}}
